Entry	Protein names	Gene Names
Q9Y7I4	Dol-P-Man:Man(5)GlcNAc(2)-PP-Dol alpha-1,3-mannosyltransferase, EC 2.4.1.258 (Asparagine-linked glycosylation protein 3) (Dol-P-Man-dependent alpha(1-3)-mannosyltransferase) (Dolichyl-P-Man:Man(5)GlcNAc(2)-PP-dolichyl mannosyltransferase) (Dolichyl-phosphate-mannose--glycolipid alpha-mannosyltransferase)	alg3 SPAC7D4.06c
Q9Y7J0	NAD-capped RNA hydrolase, DeNADding enzyme, EC 3.6.1.- (Probable NADH pyrophosphatase, EC 3.6.1.22)	SPBC1778.03c
Q9Y7J1	Sporulation-specific protein 6	spo6 SPBC1778.04
Q9Y7J6	Serine/threonine-protein kinase ppk21, EC 2.7.11.1	ppk21 SPBC1778.10c SPBC4C3.11
Q9Y7K8	Dehydrodolichyl diphosphate synthase complex subunit nus1, EC 2.5.1.87	nus1 SPBC2A9.06c
Q9Y7L0	Protein transport protein sec22	sec22 SPBC2A9.08c
Q9Y7N0	SWR1 complex bromodomain subunit bdf1	bdf1 brf1 SPCC1450.02 SPCC191.13
Q9Y7N2	Mediator of RNA polymerase II transcription subunit 19 (Mediator complex subunit 19) (RNA polymerase II mediator complex protein rox3)	med19 rox3 SPCC1450.05c
Q9Y7N3	Monothiol glutaredoxin-3	grx3 SPCC1450.06c
Q9Y7P0	Riboflavin synthase, RS, EC 2.5.1.9	rib5 SPCC1450.13c
Q9Y7P1	ERO1-like protein 2, EC 1.8.4.- (Endoplasmic reticulum oxidoreductin-1-like protein B)	ero12 SPCC1450.14c
Q9Y7T7	Pre-mRNA-splicing ATP-dependent RNA helicase prp28, EC 3.6.4.13	prp28 SPCC63.11
Q9Y7U9	tRNA nucleotidyltransferase cca2, EC 2.7.7.- (A-adding enzyme cca2) (tRNA adenylyltransferase cca2)	cca2 SPCC645.10
Q9Y7X5	UDP-glucose 4-epimerase uge1, EC 5.1.3.2 (Galactowaldenase)	uge1 SPBC365.14c
Q9Y7X8	Actin-like protein arp5	arp5 SPBC365.10
Q9Y7Y6	Proteasomal ubiquitin receptor ADRM1 homolog rpn1301 (Regulatory particle non-ATPase 13a protein)	rpn1301 rpn13a SPBC342.04
Q9Y7Z2	ADP-ribosylation factor 6	arf6 SPBC1539.08
Q9Y805	Pre-mRNA-splicing factor cwf25 (Complexed with cdc5 protein 25)	cwf25 SPBC146.05c
Q9Y806	FAD-linked sulfhydryl oxidase erv2, EC 1.8.3.2	erv2 SPBC146.04
Q9Y808	Mediator of RNA polymerase II transcription subunit 15	med15 SPBC146.01 SPBP35G2.15
Q9Y818	Ubiquitin-conjugating enzyme E2 15, EC 2.3.2.23 (E2 ubiquitin-conjugating enzyme 15) (Ubiquitin carrier protein 15) (Ubiquitin-protein ligase 15)	ubc15 SPBC1105.09
Q9Y821	Mediator of RNA polymerase II transcription subunit 4 (Mediator complex subunit 4) (RNA polymerase II mediator complex protein pmc4)	med4 pmc4 SPBC1105.06
Q9Y823	Homocitrate synthase, mitochondrial, HCS, EC 2.3.3.14	lys4 SPBC1105.02c
A6X980	Transcription factor tau subunit sfc7 (TFIIIC subunit sfc7) (Transcription factor C subunit 7)	sfc7 tfc7 SPAC1250.07
A9ZLL8	Protein lsd90 (90kDa large and small daughter protein)	lsd90 SPBC16E9.16c
B5BP47	Uncharacterized transporter C460.03	SPBC460.03
B8Y7Y5	INO80 complex subunit 5	iec5 SPAPB1E7.14
C6Y4B3	GPI mannosyltransferase 2 subunit C167.09	SPAC167.09
C6Y4C2	Sporulation-specific protein 2	spo2 SPBC16C6.14
C6Y4D3	Extender of the chronological lifespan protein 1	ecl1 SPCC70.12c
G2TRK8	Uncharacterized protein new12	gem6 new12 SPAC4D7.15
G2TRL9	Putative holo-[acyl-carrier-protein] synthase, Holo-ACP synthase, EC 2.7.8.7 (4'-phosphopantetheinyl transferase)	new8 SPAC3G9.17
G2TRR1	Gem-associated protein 7 homolog	gem7 new17 SPBC32F12.16
G2TRS3	Protein kish	ksh1 new21 SPBC530.16
G2TRU7	Wtf element wtf15	wtf15 SPCC663.17
O00091	Glucose-6-phosphate 1-dehydrogenase, G6PD, EC 1.1.1.49	zwf1 SPAC3A12.18 SPAC9.01
O13610	rRNA-processing protein fcf1	fcf1 SPBC32H8.04c
O13619	Uncharacterized protein P22H7.03	pi028 SPBP22H7.03
O13620	Multiple RNA-binding domain-containing protein 1	mrd1 pi029 SPBP22H7.02c
O13622	ATP-dependent RNA helicase mss116, mitochondrial, EC 3.6.4.13	mss116 SPACTOKYO_453.03c SPBC691.04
O13629	Putative lipoate-protein ligase A, EC 6.3.1.20	aim22 pi037 SPBC17A3.09c
O13632	Tyrosine-protein phosphatase yvh1, PTPase yvh1, EC 3.1.3.48	yvh1 pi040 SPBC17A3.06
O13633	Uncharacterized J domain-containing protein C17A3.05c	pi041 SPBC17A3.05c
O13636	Mitochondrial import inner membrane translocase subunit tim50	tim50 pi044 SPBC17A3.01c SPBC8D2.21c
O13639	Adenosylhomocysteinase, AdoHcyase, EC 3.3.1.1 (S-adenosyl-L-homocysteine hydrolase)	pi047 SPBC8D2.18c
O13642	Lipoyl synthase, mitochondrial, EC 2.8.1.8 (Lipoate synthase, LS, Lip-syn) (Lipoic acid synthase)	lip5 pi050 SPBC8D2.15
O13644	Integral membrane protein sed5	sed5 pi051 SPBC8D2.14c
O13651	Isoleucine--tRNA ligase, cytoplasmic, EC 6.1.1.5 (Isoleucyl-tRNA synthetase, IleRS)	irs1 pi058 SPBC8D2.06
O13652	Protein sfi1 (Suppressor of fermentation induced loss of stress resistance protein 1)	sfi1 pi059 SPBC8D2.05c
O13656	Probable mitochondrial import receptor subunit tom40 (Translocase of outer membrane 40 kDa subunit)	tom40 SPBC27B12.13 SPBC8D2.22
O13657	Putative metal ion transporter C27B12.12c	pi066 SPBC27B12.12c
O13663	GPI ethanolamine phosphate transferase 3, EC 2.-.-.- (Glycosylphosphatidylinositol-anchor biosynthesis protein 13)	gpi13 pi072 SPBC27B12.06
O13670	Protein MTO1 homolog, mitochondrial	mto1 pi079 SPBC30B4.06c
O13671	Importin-alpha re-exporter (Cellular apoptosis susceptibility protein homolog)	kap109 pi080 SPBC30B4.05
O13672	60S ribosomal protein L8 (L4) (L7A)	rpl8 SPBC29A3.04
O13683	Uncharacterized protein C11E3.02c	SPAC11E3.02c
O13690	PH and SEC7 domain-containing protein C11E3.11c	SPAC11E3.11c
O13698	Malonyl CoA-acyl carrier protein transacylase, mitochondrial, MCT, EC 2.3.1.39 (Malonyl-CoA:ACP transferase)	mct1 SPAC11G7.05c
O13703	Vacuolar protein sorting-associated protein vts1 (VPS20-associated protein 1)	vts1 new6 SPAC13F5.04c SPAC13F5.08
O13714	Uncharacterized membrane protein C14C4.07	SPAC14C4.07
O13718	Vacuolar transporter chaperone 2	vtc2 SPAC14C4.11
O13735	Actin-interacting protein 3 homolog	fat1 SPAC15A10.16 SPAC15E1.01
O13737	2-hydroxy-palmitic acid dioxygenase mpo1, EC 1.14.18.12 (Metabolism of phytosphingosine to odd-numbered fatty acids protein 1, Metabolism of PHS to odd-numbered FA protein 1)	mpo1 SPAC16E8.02
O13738	Glucosamine 6-phosphate N-acetyltransferase, EC 2.3.1.4 (Phosphoglucosamine acetylase) (Phosphoglucosamine transacetylase)	gna1 SPAC16E8.03
O13739	Chorismate mutase, CM, EC 5.4.99.5	aro7 SPAC16E8.04c
O13741	Nucleolar protein 12	nop12 SPAC16E8.06c
O13742	V-type proton ATPase subunit a, V-ATPase a subunit (Vacuolar ATPase 91 kDa subunit) (Vacuolar proton pump a subunit) (Vacuolar proton translocating ATPase subunit a)	vph1 SPAC16E8.07c
O13744	37S ribosomal protein S7, mitochondrial	rsm7 SPAC16E8.10c
O13747	RING finger protein ETP1 homolog (BRAP2 homolog)	SPAC16E8.13
O13748	Alpha N-terminal protein methyltransferase 1, EC 2.1.1.244 (Translation associated element 1) (X-Pro-Lys N-terminal protein methyltransferase 1, NTM1)	tae1 ntm1 SPAC16E8.14c
O13749	Transcription initiation factor IIB (General transcription factor TFIIB)	sua7 SPAC16E8.16
O13750	Succinate--CoA ligase [ADP-forming] subunit alpha, mitochondrial, EC 6.2.1.5 (Succinyl-CoA synthetase subunit alpha, SCS-alpha)	SPAC16E8.17c
O13753	V-type proton ATPase subunit d, V-ATPase subunit d (V-ATPase 39 kDa subunit) (V-ATPase subunit M39) (Vacuolar proton pump subunit d)	vma6 SPAC17A2.03c
O13754	Hsp70/Hsp90 co-chaperone cns1	cns1 SPAC17A2.04c
O13756	Vacuolar protein sorting-associated protein 8 (Vacuolar protein-targeting protein 8)	vps8 SPAC17A2.06c
O13764	Peroxisomal ATPase pex6 (Peroxin-6) (Peroxisome biosynthesis protein pex6)	pex6 SPAC17A5.01
O13765	Lariat debranching enzyme, EC 3.1.-.-	dbr1 SPAC17A5.02c
O13769	Ubiquitin-like-specific protease 2, EC 3.4.22.-	ulp2 SPAC17A5.07c
O13770	Uncharacterized membrane protein C17A5.08	SPAC17A5.08
O13773	UBA domain-containing protein 7	ucp7 SPAC17A5.12
O13776	Ubp5-interacting protein ftp105 (Down-regulated in multiple cancers 1 homolog 3) (Hid-1 family protein ftp105)	ftp105 SPAC17A5.16
O13785	Protein transport protein use1	use1 SPAC17G6.07c
O13786	Vacuolar segregation protein pep7	pep7 vac1 SPAC17G6.08
O13787	Translocation protein sec62	sec62 SPAC17G6.09
O13789	Uncharacterized beta-glucan synthesis-associated protein C17G6.11c	SPAC17G6.11c
O13796	Ribosome quality control complex subunit 1	rqc1 SPAC1142.01 SPAC17G6.18
O13797	Small glutamine-rich tetratricopeptide repeat-containing protein 2	sgt2 SPAC1142.02c SPAC17G6.19c
O13810	Probable glutamate 5-kinase, GK, EC 2.7.2.11 (Gamma-glutamyl kinase)	SPAC17H9.13c
O13814	Mitochondrial distribution and morphology protein 10 (Mitochondrial inheritance component mdm10)	mdm10 SPAC17H9.17c
O13817	Protein transport protein sec73	sec73 sec7c SPAC19A8.01c SPAC23H3.01
O13819	Phosphoinositide 3-phosphatase, EC 3.1.3.64	SPAC19A8.03
O13830	Probable peptidyl-tRNA hydrolase 2, PTH 2, EC 3.1.1.29	SPAC19A8.14
O13831	Tryptophan synthase, EC 4.2.1.20	trp2 SPAC19A8.15
O13835	U3 small nucleolar ribonucleoprotein protein imp3, U3 snoRNP protein imp3	imp3 SPAC19D5.05c
O13843	Ureidoglycolate lyase, EC 4.3.2.3 (Ureidoglycolatase)	SPAC19G12.04
O13845	RNA-binding protein rsd1	rsd1 SPAC19G12.07c
O13850	Ubiquinone biosynthesis protein coq9, mitochondrial	coq9 SPAC19G12.11
O13855	Uncharacterized protein C1A6.01c	SPAC1A6.01c SPAC23C4.20c
O13862	Transcriptional activator protein rdp1 (Rhp51-DRE-binding protein 1)	rdp1 SPAC1B1.01
O13865	PAB-dependent poly(A)-specific ribonuclease subunit pan3-like (PAB1P-dependent poly(A)-nuclease)	SPAC1B1.04c
O13867	Uracil phosphoribosyltransferase 1, UPRTase 1, EC 2.4.2.9 (UMP pyrophosphorylase 1)	SPAC1B3.01c
O13868	Transcription elongation factor 1 homolog	SPAC1B3.02c
O13869	Translation factor guf1, mitochondrial, EC 3.6.5.- (Elongation factor 4 homolog, EF-4) (GTPase guf1) (Ribosomal back-translocase)	guf1 SPAC1B3.04c
O13872	Vacuolar protein sorting-associated protein 28 homolog (ESCRT-I complex subunit vps28)	vps28 SPAC1B3.07c
O13876	GTP-binding protein ypt4	ypt4 SPAC1B3.11c
O13878	U3 small nucleolar RNA-associated protein 17, U3 snoRNA-associated protein 17 (U3 protein 17 required for transcription)	utp17 SPAC1B3.13
O13890	Protein adenylyltransferase SelO, mitochondrial, EC 2.7.7.- (Selenoprotein O, SelO)	SPAC20G4.05c
O13892	Uncharacterized protein C20G4.08	SPAC20G4.08 SPAC4F10.01
O13895	COP9 signalosome complex subunit 4, CSN complex subunit 4, SGN4	csn4 SPAC22A12.03c
O13897	Uncharacterized hydrolase C22A12.06c, EC 3.1.-.-	SPAC22A12.06c
O13899	Uncharacterized CDP-alcohol phosphatidyltransferase class-I family protein C22A12.08c	SPAC22A12.08c
O13900	Pre-mRNA-splicing factor sap114 (Spliceosome-associated protein 145)	sap114 SPAC22A12.09c
O13904	Meiotically up-regulated gene 84 protein	mug84 SPAC22A12.13
O13910	U3 small nucleolar ribonucleoprotein protein mpp10	mpp10 SPAC23C11.03
O13920	LETM1 domain-containing protein mdm28, mitochondrial	mdm28 SPAC23C11.17
O13921	MutS protein homolog 1	msh1 SPAC13F5.01c SPAC23C11.18c
O13931	ATP synthase subunit J, mitochondrial	atp18 SPAC23C4.11
O13932	Protein transport protein bet1	bet1 SPAC23C4.13
O13940	Probable low-specificity L-threonine aldolase, EC 4.1.2.48	gly1 SPAC23H3.09c
O13941	Uncharacterized beta-glucan synthesis-associated protein C23H3.11c	SPAC23H3.11c
O13945	Protein kinase domain-containing protein ppk9	ppk9 SPAC23H4.02
O13946	Endoplasmic reticulum vesicle protein 25	erv25 SPAC23H4.03c
O13947	Mitochondrial tRNA-specific 2-thiouridylase 1, EC 2.8.1.14	SPAC23H4.04
O13950	Signal recognition particle receptor subunit beta, SR-beta	srp102 SPAC23H4.07c
O13956	Ribosome biogenesis protein tsr1	tsr1 SPAC23H4.15
O13962	Putative holocytochrome-c1 synthase, EC 4.4.1.17 (Cytochrome c1 heme lyase, CC1HL)	SPAC24C9.02c
O13963	Diphosphomevalonate decarboxylase, EC 4.1.1.33 (Mevalonate pyrophosphate decarboxylase) (Mevalonate-5-diphosphate decarboxylase, MDDase)	mvd1 SPAC24C9.03
O13965	Meiotically up-regulated gene 70 protein	mug70 SPAC24C9.05c
O13968	Uncharacterized carboxypeptidase C24C9.08, EC 3.4.17.-	SPAC24C9.08
O13981	ER membrane protein complex subunit 1	emc1 SPAC25H1.07
O13984	ATPase WRNIP1 homolog C26H5.02c	SPAC26H5.02c
O13987	Ankyrin and IPT/TIG repeat-containing protein C26H5.05	SPAC26H5.05
O13992	Forespore membrane adapter protein MUG56 (Meiotically up-regulated gene 56 protein)	mug56 SPAC26H5.11
O13994	Inositol phosphorylceramide synthase regulatory subunit kei1, ICP synthase regulatory subunit kei1	kei1 SPAC26H5.13c
O13996	Uncharacterized glycosyl hydrolase C27E2.01, EC 3.2.1.-	SPAC27E2.01
O13997	Protein IMPACT homolog	yih1 SPAC27E2.02
O13998	Obg-like ATPase 1	SPAC27E2.03c
O13999	Meiotically up-regulated gene 155 protein	mug155 SPAC27E2.04c
O14000	Probable methionine--tRNA ligase, mitochondrial, EC 6.1.1.10 (Mitochondrial methionyl-tRNA synthetase, MtMetRS)	SPAC27E2.06c
O14010	Mediator of RNA polymerase II transcription subunit 22 (Mediator complex subunit 22) (Suppressor of RNA polymerase B 6 homolog)	med22 srb6 SPAC29A4.07
O14012	Ribosomal RNA-processing protein 17	rrp17 SPAC29A4.09
O14013	RNA polymerase I-specific transcription initiation factor rrn5	rrn5 SPAC29A4.10
O14018	Serine--tRNA ligase, cytoplasmic, EC 6.1.1.11 (Seryl-tRNA synthetase, SerRS) (Seryl-tRNA(Ser/Sec) synthetase)	SPAC29A4.15
O14028	Probable MRF1 mitochondrial N(5)-glutamine methyltransferase mtq1, EC 2.1.1.297	mtq1 SPAC29B12.05c
O14035	Uncharacterized permease C29B12.14c	SPAC29B12.14c
O14039	25S rRNA (cytosine-C(5))-methyltransferase rcm1, EC 2.1.1.- (rRNA m(5)C methyltransferase 1)	rcm1 SPAC2C4.06c
O14043	Uncharacterized protein C2C4.10c	SPAC2C4.10c
O14046	Probable V-type proton ATPase 20 kDa proteolipid subunit, V-ATPase 20 kDa proteolipid subunit (Vacuolar proton pump 20 kDa proteolipid subunit)	vma16 SPAC2C4.13
O14048	UBX domain-containing protein 2	ubx2 SPAC2C4.15c
O14055	Tyrosine--tRNA ligase, cytoplasmic, EC 6.1.1.1 (Tyrosyl-tRNA synthetase, TyrRS)	tys1 SPCC1672.05c
O14056	Cytochrome c oxidase assembly protein cox19, mitochondrial	cox19 SPCC1672.04c
O14057	Probable guanine deaminase, Guanase, Guanine aminase, EC 3.5.4.3 (Guanine aminohydrolase, GAH)	SPCC1672.03c
O14065	Uncharacterized protein C962.01	SPCC962.01 SPCP31B10.09
O14066	Increased rDNA silencing protein 4 homolog	SPAC1687.09
O14076	Uncharacterized protein UNK4.11c	SPAC2E11.11c SPACUNK4.11c
O14077	Putative zinc protease mug138, EC 3.4.24.- (Meiotically up-regulated gene 138 protein)	mug138 SPAC2E11.12c SPACUNK4.12c
O14081	Putative alpha,alpha-trehalose-phosphate synthase [UDP-forming] 106 kDa subunit, EC 2.4.1.15 (Trehalose-6-phosphate synthase) (UDP-glucose-glucosephosphate glucosyltransferase)	SPAC2E11.16c SPACUNK4.16c
O14085	Translocation protein sec72	sec72 SPAC2F3.02
O14086	DNA-directed RNA polymerase I subunit rpa49, RNA polymerase I subunit A49 (DNA-directed RNA polymerase I 49 kDa polypeptide)	rpa49 SPAC2F3.03c
O14087	Single-stranded DNA-binding protein rim1, mitochondrial (Mitochondrial ssDNA-binding protein)	rim1 SPAC2F3.04c
O14088	Uncharacterized oxidoreductase C2F3.05c, EC 1.-.-.-	SPAC2F3.05c
O14093	Vacuolar protein sorting-associated protein 54	vps54 SPAC2F3.10
O14094	Putative exopolyphosphatase, ExopolyPase, EC 3.6.1.11 (Metaphosphatase)	SPAC2F3.11
O14095	Thioredoxin domain-containing protein plp1 (Phosducin-like protein 1)	plp1 SPAC2F3.12c
O14096	Queuine tRNA-ribosyltransferase accessory subunit 2 (Queuine tRNA-ribosyltransferase domain-containing protein 1)	SPAC2F3.13c
O14102	Spliceosome-associated protein 49	sap49 SPAC31G5.01 SPAPB1A11.05
O14103	Protein rot1	rot1 SPAC31G5.02
O14104	Homoisocitrate dehydrogenase, HICDH, EC 1.1.1.87	lys12 SPAC31G5.04
O14105	Ribulose-phosphate 3-epimerase, EC 5.1.3.1 (Pentose-5-phosphate 3-epimerase, PPE) (RPE)	SPAC31G5.05c
O14109	Repressor of RNA polymerase III transcription maf1	maf1 N150 SPAC31G5.12c
O14110	Probable aminomethyltransferase, mitochondrial, EC 2.1.2.10 (Glycine cleavage system T protein, GCVT)	gcv1 n313 SPAC31G5.14
O14120	Sorting nexin mvp1	mvp1 SPAC3A11.06
O14121	Probable NADH-ubiquinone oxidoreductase C3A11.07, mitochondrial, EC 1.6.5.9	SPAC3A11.07
O14123	Probable Na(+)/H(+) antiporter C3A11.09	sod22 SPAC3A11.09
O14124	Uncharacterized dipeptidase C3A11.10c, EC 3.4.13.19	SPAC3A11.10c
O14126	26S proteasome regulatory subunit 6A	tbp1 pam2 SPAC3A11.12c SPAC3H5.01
O14128	Probable sphingolipid long chain base-responsive protein pil2 (Protein kinase inhibitor pil2)	pil2 SPAC3C7.02c
O14131	Meiotically up-regulated gene 191 protein	mug191 SPAC3C7.05c
O14133	Arginyl-tRNA--protein transferase 1, Arginyltransferase 1, R-transferase 1, EC 2.3.2.8 (Arginine-tRNA--protein transferase 1)	SPAC3C7.07c
O14136	Peroxisomal membrane protein pex13 (Peroxin-13)	pex13 SPAC3C7.10
O14137	Probable glucose-6-phosphate 1-dehydrogenase C7.13c, G6PD, EC 1.1.1.49	SPAC3C7.13c
O14144	Mitochondrial FAD-linked sulfhydryl oxidase erv1, EC 1.8.3.2	erv1 SPAC3G6.08
O14160	Valine--tRNA ligase, mitochondrial, EC 6.1.1.9 (Valyl-tRNA synthetase, ValRS)	vas1 SPAC4A8.08c
O14161	Pre-mRNA-splicing factor cwf21 (Complexed with cdc5 protein 21)	cwf21 SPAC4A8.09c
O14169	Phosphatidylglycerol phospholipase C, EC 3.1.4.-	SPAC4D7.02c
O14176	Pre-mRNA-processing protein prp40	prp40 SPAC4D7.13
O14179	Ribosome maturation protein sdo1	sdo1 SPAC4F8.03
O14180	Brix domain-containing protein C4F8.04	SPAC4F8.04
O14189	Protein phosphatase 2C homolog C10F6.17c, EC 3.1.3.16 (Pyruvate dehydrogenase (Lipoamide) phosphatase C10F6.17c)	SPAC10F6.17c
O14190	UDP-N-acetylglucosamine transferase subunit alg13, EC 2.4.1.141 (Asparagine-linked glycosylation protein 13)	alg13 SPAC56E4.02c
O14192	Aromatic amino acid aminotransferase C56E4.03, EC 2.6.1.57	SPAC56E4.03
O14193	SRP-independent targeting protein 2 homolog (Meiotically up-regulated gene 69 protein)	mug69 SPAC56E4.05
O14196	Meiotically up-regulated gene 165 protein	mug165 SPAC5D6.02c
O14199	UDP-N-acetylglucosamine transferase subunit alg14 (Asparagine-linked glycosylation protein 14)	alg14 SPAC5D6.06c
O14200	PXA domain protein 1	pxa1 SPAC5D6.07c
O14207	Protein mms22 (Protein mus7)	mus7 mms22 SPAC6B12.02c
O14212	Uncharacterized RING finger protein C6B12.07c	SPAC6B12.07c
O14224	Rho GDP-dissociation inhibitor, Rho GDI	SPAC6F12.06
O14225	Mitochondrial import receptor subunit tom20 (Mitochondrial 20 kDa outer membrane protein) (Translocase of outer membrane 20 kDa subunit)	tom20 SPAC6F12.07
O14226	Exocyst complex component exo84	exo84 SPAC6F12.08c
O14233	mRNA 3'-end-processing protein rna14	rna14 SPAC6F12.17
O14234	Calcium-channel protein cch1	cch1 SPAC6F6.01
O14236	Nucleolar GTP-binding protein 2	nog2 SPAC6F6.03c
O14238	Probable dolichyl-diphosphooligosaccharide--protein glycosyltransferase subunit ost2 (Oligosaccharyl transferase 16 kDa subunit) (Oligosaccharyl transferase subunit epsilon)	ost2 SPAC6F6.05
O14242	Putative pyridoxal kinase C6F6.11c, EC 2.7.1.35	SPAC6F6.11c
O14250	Probable proteasome subunit alpha type-6	SPAC6G10.04c
O14251	Transport protein particle subunit trs120, TRAPP subunit trs120	trs120 SPAC6G10.05c
O14252	Putative oxidoreductase C6G10.06, EC 1.-.-.-	SPAC6G10.06
O14254	Probable isocitrate dehydrogenase [NADP], mitochondrial, IDH, EC 1.1.1.42 (IDP) (NADP(+)-specific ICDH) (Oxalosuccinate decarboxylase)	idp1 SPAC6G10.08
O14258	Metallothionein expression activator	ace2 SPAC6G10.12c
O14269	Uncharacterized protein C7D4.14c	SPAC7D4.14c
O14270	Fork head transcription factor 1	fhl1 SPAC1142.08 SPAC8C9.01
O14273	Meiotically up-regulated protein C8C9.04	SPAC8C9.04
O14274	D-aminoacyl-tRNA deacylase, DTD, EC 3.1.1.96 (Gly-tRNA(Ala) deacylase)	dtd1 SPAC8C9.05
O14275	Pentatricopeptide repeat-containing protein 4, mitochondrial	ppr4 SPAC8C9.06c
O14277	40S ribosomal protein S5-A	rps5 rps501 rps5a SPAC8C9.08
O14279	Ribosomal RNA-processing protein 14-N (Ribosome biogenesis protein rrp14-N)	rrp14n SPAC8C9.10c
O14280	Uncharacterized bolA-like protein C8C9.11	SPAC8C9.11
O14284	Oxidation resistance protein 1 (Meiotically up-regulated gene 63 protein)	oxr1 mug63 SPAC8C9.16c
O14293	Putative aldehyde dehydrogenase-like protein C9E9.09c, EC 1.2.1.-	SPAC9E9.09c
O14296	Vacuolar protein sorting-associated protein 24	vps24 SPAC9E9.14
O14300	Mitochondrial inner membrane protein oxa1-1 (Cytochrome oxidase biogenesis protein 1-1, Sp1)	oxa101 oxa1-1 SPAC9G1.04
O14301	Uncharacterized WD repeat-containing protein C9G1.05	SPAC9G1.05
O14306	Probable inositol polyphosphate 5-phosphatase C9G1.10c, EC 3.1.3.-	SPAC9G1.10c
O14307	tRNA (adenine(58)-N(1))-methyltransferase catalytic subunit trm61, EC 2.1.1.220 (tRNA(m1A58)-methyltransferase subunit trm61, tRNA(m1A58)MTase subunit trm61)	cpd1 trm61 SPAC9G1.12
O14308	SWR1-complex protein 4	swc4 SPAC9G1.13c
O14317	60S acidic ribosomal protein P2-C	rpp203 rla6 rpp2-3 SPAC1071.08
O14323	Meiotic coiled-coil protein 4 (Meiotically up-regulated gene 101 protein)	mcp4 mug101 SPBC16E9.08
O14324	Uncharacterized membrane protein C16E9.09c	SPBC16E9.09c
O14325	Uncharacterized AAA domain-containing protein C16E9.10c	SPBC16E9.10c
O14326	E3 ubiquitin-protein ligase pub3, EC 2.3.2.26 (HECT-type E3 ubiquitin transferase pub3)	pub3 SPBC16E9.11c
O14332	Meiosis-specific cyclin rem1	rem1 SPBC16E9.17c
O14336	Meiotically up-regulated gene 80 protein	mug80 SPBC1D7.03
O14338	Uncharacterized serine-rich protein C2F12.03c	SPBC2F12.03c
O14346	Probable very-long-chain (3R)-3-hydroxyacyl-CoA dehydratase, EC 4.2.1.134 (3-hydroxyacyl-CoA dehydratase, HACD)	SPBC19C2.15c SPBC2F12.16
O14348	Negative cofactor 2 complex subunit beta, NC2 complex subunit beta	ncb2 SPBC30D10.02
O14349	IMP-specific 5'-nucleotidase 1, EC 3.1.3.99	isn1 SPBC30D10.03c
O14354	Mitochondrial genome maintenance protein mgm101	mgm101 SPBC30D10.08
O14357	N-acetylglucosaminyl-phosphatidylinositol biosynthetic protein gpi1	gpi1 SPBC30D10.11
O14361	Putative prephenate dehydratase, PDT, EC 4.2.1.51	pha2 SPBC30D10.16
O14363	60S ribosomal protein L1-A (L10a)	rpl102 rpl1a SPBC30D10.18c
O14369	Probable RNA-binding protein sce3	sce3 SPBC18H10.04c
O14399	Ubiquitin-like protein 1	ubl1 ned8 SPBC12D12.08c SPBC24C6.01c
O14400	Glycerol-3-phosphate dehydrogenase, mitochondrial, GPD-M, GPDH-M, EC 1.1.5.3	gut2 SPCC1223.03c
O14423	CENP-B homolog protein 1, CBHP-1	cbh1 cbh SPAC9E9.10c
O14443	GPN-loop GTPase 3, EC 3.6.5.- (Factor of eukaryotic transcription 5)	fet5 SPAC4D7.12c
O36016	Serine/threonine-protein phosphatase 2A activator 1, EC 5.2.1.8 (Peptidyl-prolyl cis-trans isomerase PTPA-1, PPIase PTPA-1, Rotamase PTPA-1) (Phosphotyrosyl phosphatase activator 1)	rrd1 SPAC4F10.04
O36017	Probable octanoyltransferase, EC 2.3.1.181 (Lipoate biosynthesis protein) (Lipoate-protein ligase) (Lipoyl ligase) (Lipoyl/octanoyl transferase) (Octanoyl-[acyl-carrier-protein]-protein N-octanoyltransferase)	SPAC4F10.05c
O36025	GYF domain-containing protein mpd2	mpd2 SPAC4F10.13c
O36028	Putative phospholipid-transporting ATPase C4F10.16c, EC 7.6.2.1	SPAC4F10.16c
O36032	Glutaredoxin-1	grx1 SPAC4F10.20
O42648	HMG box-containing protein C10F6.08c	SPAC10F6.08c
O42656	Guanine nucleotide exchange factor subunit ric1 (Protein ric1)	ric1 SPAC1851.04c SPAC27D7.01c
O42662	U6 small nuclear RNA (adenine-(43)-N(6))-methyltransferase, EC 2.1.1.346	SPAC27D7.08c
O42700	Transaldolase, EC 2.2.1.2	tal1 SPCC1020.06c
O42707	L-type lectin-like domain-containing protein C4F6.05c	SPBC4F6.05c
O42848	60S ribosomal protein L16-A	rpl1602 rpl16a SPAC23A1.11
O42849	Phenylalanine--tRNA ligase beta subunit, EC 6.1.1.20 (Phenylalanyl-tRNA synthetase beta subunit, PheRS)	frs1 SPAC23A1.12c
O42852	Protein transport protein sec20	sec20 SPAC23A1.15c
O42853	Putative RNA polymerase II subunit B1 CTD phosphatase rtr1, EC 3.1.3.16 (RNA polymerase II-associated protein 2 homolog rtr1)	SPAC23A1.16c
O42854	SH3 domain-containing protein C23A1.17	SPAC23A1.17
O42857	Nitrogen permease regulator 2 homolog	SPAC23H3.03c
O42858	Set1 complex component swd1, Set1C component swd1 (COMPASS component swd1) (Complex proteins associated with set1 protein swd1)	swd1 SPAC23H3.05c
O42866	3-oxoacyl-[acyl-carrier-protein] reductase, EC 1.1.1.100 (3-ketoacyl-acyl carrier protein reductase)	oar2 SPAC3G9.02
O42870	Phenylalanine--tRNA ligase alpha subunit, EC 6.1.1.20 (Phenylalanyl-tRNA synthetase alpha subunit, PheRS)	frs2 SPAC3G9.06
O42873	Putative pyruvate decarboxylase C3G9.11c, EC 4.1.1.1	SPAC3G9.11c
O42875	Tryptophan--tRNA ligase, mitochondrial, EC 6.1.1.2 (Tryptophanyl-tRNA synthetase, TrpRS)	msw1 SPAC3G9.13c
O42878	Putative invertase, EC 3.2.1.26 (Beta-fructofuranosidase) (Saccharase)	SPAC8E11.01c SPAC959.01
O42881	Acyl-protein thioesterase 1, EC 3.1.2.- (Palmitoyl-protein hydrolase, EC 3.1.2.22)	SPAC8E11.04c
O42885	Putative inorganic phosphate transporter C8E4.01c	SPBC8E4.01c SPBP4G3.01
O42887	Putative agmatinase 2, EC 3.5.3.11 (Agmatine ureohydrolase 2, AUH 2)	SPBC8E4.03
O42897	Probable 26S proteasome regulatory subunit rpn3	rpn3 SPBC119.01 SPBPJ4664.07
O42898	Probable catechol O-methyltransferase 1, EC 2.1.1.6	SPBC119.03
O42906	GPN-loop GTPase 1, EC 3.6.5.-	SPBC119.15
O42908	Mitochondrial presequence protease, EC 3.4.24.-	cym1 SPBC119.17
O42910	Pentatricopeptide repeat-containing protein 7, mitochondrial	ppr7 SPBC16A3.03c
O42912	tRNA-specific adenosine deaminase 1, EC 3.5.4.34 (tRNA-specific adenosine-37 deaminase)	SPBC16A3.06
O42914	Uncharacterized protein C16A3.08c	SPBC16A3.08c
O42915	Ubiquitin fusion degradation protein 1, UB fusion protein 1	ufd1 SPBC16A3.09c
O42924	Probable chromatin modification-related protein eaf7	eaf7 SPBC16A3.19
O42926	Intermembrane lipid transfer protein vps1302 (Vacuolar protein sorting-associated protein 13b)	vps1302 vps13b SPBC16C6.02c
O42932	Cytochrome b-c1 complex subunit 6 (Complex III subunit 6) (Mitochondrial hinge protein) (Ubiquinol-cytochrome c reductase complex subunit 6)	qcr6 SPBC16C6.08c
O42937	Probable coatomer subunit beta' (Beta'-coat protein, Beta'-COP)	sec27 SPBC16C6.13c SPBC244.03
O42943	Uncharacterized ABC transporter ATP-binding protein C16H5.08c	SPBC16H5.08c
O42944	O-glycoside alpha-1,2-mannosyltransferase homolog 2, EC 2.4.1.-	omh2 SPBC16H5.09c
O42951	Putative aminodeoxychorismate lyase, EC 4.1.3.38 (4-amino-4-deoxychorismate lyase, ADC lyase, ADCL)	SPBC19G7.02
O42958	DNA topoisomerase 2-associated protein pat1 (Decapping activator and translational repressor pat1) (Topoisomerase II-associated protein pat1)	SPBC19G7.10c
O42962	Conserved oligomeric Golgi complex subunit 5, COG complex subunit 5	cog5 SPBC19G7.14c
