Entry	Protein names	Gene Names
O13606	Meiosis-specific transcription factor mei4	mei4 pi013 SPBC32H8.11
O13612	NEDD8-specific protease 2, EC 3.4.22.- (Meiotically up-regulated gene 120 protein)	nep2 mug120 pi021 SPBC32H8.02c
O13615	Pre-mRNA-splicing factor prp5 (Complexed with cdc5 protein 1) (Pre-mRNA-processing protein 5)	prp5 cwf1 pi024 SPBP22H7.07
O13637	Protein transport protein sec31	sec31 SPBC8D2.20c
O13665	Factor arrest protein 11	far11 pi074 SPBC27B12.04c
O13681	Integral inner nuclear membrane protein ima1	IMA1 SPCC737.03c
O13682	Helicase swr1, EC 3.6.4.12	swr1 SPAC11E3.01c SPAC2H10.03c
O13686	Uncharacterized RWD, RING finger and WD repeat-containing protein C11E3.05	SPAC11E3.05
O13696	Isocitrate dehydrogenase [NAD] subunit 1, mitochondrial, EC 1.1.1.41 (Isocitric dehydrogenase) (NAD(+)-specific ICDH)	idh1 SPAC11G7.03
O13701	Transcription initiation factor TFIID subunit 7 (Transcription initiation factor TFIID 55 kDa subunit, TAFII-55)	taf7 ptr6 SPAC13F5.02c
O13702	Glycerol dehydrogenase 1, GDH, GLDH, EC 1.1.1.6	gld1 SPAC13F5.03c
O13705	Exocyst complex component sec10	sec10 SPAC13F5.06c
O13713	Nuclear polyadenylated RNA-binding protein nab2	nab2 SPAC14C4.06c
O13719	SWIRM domain-containing protein laf1 (Clr6 L-associated factor 1)	laf1 SPAC14C4.12c
O13722	Transcription initiation factor TFIID subunit 12 (TBP-associated factor 12)	taf12 SPAC15A10.02
O13725	NAD(P)H-hydrate epimerase, EC 5.1.99.6 (Meiotically up-regulated gene 182 protein) (NAD(P)HX epimerase)	mug182 SPAC15A10.05c
O13726	Uncharacterized Na(+)/H(+) antiporter C15A10.06	SPAC15A10.06
O13729	SUR7 family protein pun1	pun1 sur7 SPAC15A10.09c
O13731	E3 ubiquitin-protein ligase ubr11, EC 2.3.2.27 (N-end-recognizing protein 11, N-recognin-11) (RING-type E3 ubiquitin transferase ubr11)	ubr11 SPAC15A10.11
O13745	General transcription and DNA repair factor IIH subunit tfb1, TFIIH subunit tfb1 (RNA polymerase II transcription factor B 73 kDa subunit) (RNA polymerase II transcription factor B p73 subunit) (RNA polymerase II transcription factor B subunit 1)	tfb1 SPAC16E8.11c
O13755	Fumarate reductase, FRDS, EC 1.3.1.6 (FAD-dependent oxidoreductase) (NADH-dependent fumarate reductase)	osm1 SPAC17A2.05
O13774	GTP cyclohydrolase 1, EC 3.5.4.16 (GTP cyclohydrolase I, GTP-CH-I)	SPAC17A5.13
O13775	Probable glutamate--tRNA ligase, cytoplasmic, EC 6.1.1.17 (Glutamyl-tRNA synthetase, GluRS)	gus1 ers1 SPAC17A5.15c
O13777	Splicing factor saf5	saf5 icln lot5 SPAC1610.01 SPAC17A5.17
O13779	Putative metal ion transporter C17A12.14	SPAC17A2.14 SPAC17G6.01
O13782	Protein farnesyltransferase subunit beta, FTase-beta, EC 2.5.1.58 (CAAX farnesyltransferase subunit beta) (Ras proteins prenyltransferase subunit beta)	cpp1 SPAC17G6.04c
O13792	ATP-dependent RNA helicase uap56, EC 3.6.4.13	uap56 sub2 SPAC17G6.14c
O13794	Endoribonuclease ysh1, EC 3.1.27.- (mRNA 3'-end-processing protein ysh1)	ysh1 SPAC17G6.16c
O13800	DNA repair protein rdl1 (RAD51D-like protein 1)	rdl1 SPAC17H9.03c
O13802	Probable rRNA-processing protein ebp2	ebp2 SPAC17H9.05
O13808	Actin-depolymerizing factor gmf1 (Glia maturation factor-like protein 1)	gmf1 SPAC17H9.11
O13811	Protein disulfide-isomerase C17H9.14c, EC 5.3.4.1	SPAC17H9.14c
O13824	Nonsense-mediated mRNA decay protein 2 (Up-frameshift suppressor 2)	upf2 SPAC19A8.08
O13829	U1 small nuclear ribonucleoprotein 70 kDa homolog, U1 70K, U1 snRNP 70 kDa homolog, U1-70K (U1 small nuclear ribonucleoprotein usp101, U1 snRNP protein usp101)	usp101 snp1 SPAC19A8.13
O13834	E3 ubiquitin-protein ligase ptr1, EC 2.3.2.26 (HECT-type E3 ubiquitin transferase ptr1) (Poly(A)+ RNA transport protein 1)	ptr1 SPAC19D5.04
O13846	Ceramide very long chain fatty acid hydroxylase scs7, Ceramide VLCFA hydroxylase scs7, EC 1.14.18.-	scs7 SPAC19G12.08
O13848	NAD/NADP-dependent indole-3-acetaldehyde reductase, EC 1.1.1.190, EC 1.1.1.191 (AKR3C2)	SPAC19G12.09
O13851	Decaprenyl-diphosphate synthase subunit 2, EC 2.5.1.91 (All-trans-decaprenyl-diphosphate synthase subunit 2) (Decaprenyl pyrophosphate synthase subunit 2)	dlp1 SPAC19G12.12
O13852	Protection of telomeres protein poz1 (Pot1-associated protein poz1)	poz1 SPAC19G12.13c
O13857	Putative lysophospholipase SPAC1A6.03c, EC 3.1.1.5 (Phospholipase B)	SPAC1A6.03c
O13858	Eisosome protein sle1 (SEG1-like eisosome protein 1)	sle1 seg1 SPAC1A6.07
O13864	Importin subunit beta-1 (Importin-95) (Karyopherin subunit beta-1) (Karyopherin-95)	kap95 SPAC1B1.03c
O13870	General negative regulator of transcription subunit 3	not3 SPAC1B3.05
O13880	Vitamin H transporter 1 (H(+)/biotin symporter vht1)	vht1 SPAC1B3.16c
O13896	DNA-directed RNA polymerase III subunit RPC10, RNA polymerase III subunit C10 (DNA-directed RNA polymerases III 12.5 kDa polypeptide) (RNA polymerase III subunit C11)	rpc11 SPAC22A12.05
O13903	Exosome complex component rrp40 (Ribosomal RNA-processing protein 40)	rrp40 SPAC22A12.12c
O13907	Probable ATP-citrate synthase subunit 2, EC 2.3.3.8 (ATP-citrate (pro-S-)-lyase 2) (Citrate cleavage enzyme subunit 2)	SPAC22A12.16
O13914	Alanine--tRNA ligase, EC 6.1.1.7 (Alanyl-tRNA synthetase, AlaRS)	ala1 ars1 SPAC23C11.09
O13916	Anaphase-promoting complex subunit hcn1 (20S cyclosome/APC complex protein hcn1) (Chaperone-like protein hcn1) (High copy suppressor of cut9 protein 1)	hcn1 SPAC23C11.12
O13923	Coronin-like protein crn1	crn1 SPAC23C4.02
O13930	Rab guanine nucleotide exchange factor sec2 (GDP-GTP exchange factor sec2)	sec2 SPAC23C4.10
O13933	Chitobiosyldiphosphodolichol beta-mannosyltransferase, EC 2.4.1.142 (Asparagine-linked glycosylation protein 1) (Beta-1,4-mannosyltransferase) (GDP-Man:GlcNAc2-PP-dolichol mannosyltransferase) (GDP-mannose-dolichol diphosphochitobiose mannosyltransferase)	alg1 SPAC23C4.14
O13934	Putative lipase atg15, EC 3.1.1.3 (Autophagy-related protein 15)	atg15 SPAC23C4.16c
O13939	AP-3 complex subunit beta (Adaptor-related protein complex 3 subunit beta) (Beta-3-adaptin) (Clathrin assembly protein complex 3 beta large chain) (Clathrin assembly protein large beta chain)	apl6 SPAC23H3.06
O13944	Oxysterol-binding protein homolog C23H4.01c	SPAC23H4.01c SPAP27G11.01
O13952	Inner kinetochore subunit cnl2 (Centromere-localized protein 2) (Constitutive centromere-associated network protein cnl2)	cnl2 SPAC23H4.11c
O13955	Vacuolar morphogenesis protein 6 (Vacuolar protein sorting-associated protein 39)	vam6 vps39 SPAC23H4.14
O13960	Cell wall protein ecm33	ecm33 SPAC1705.03c SPAC1F2.01 SPAC23H4.19
O13966	Aconitate hydratase, mitochondrial, Aconitase, EC 4.2.1.3 (Citrate hydro-lyase)	SPAC24C9.06c
O13967	1,3-beta-glucan synthase component bgs2, EC 2.4.1.34 (1,3-beta-D-glucan-UDP glucosyltransferase) (Meiotic expression up-regulated protein 21)	bgs2 meu21 SPAC24C9.07c
O13972	Probable serine hydroxymethyltransferase, cytosolic, SHMT, EC 2.1.2.1 (Glycine hydroxymethyltransferase) (Serine methylase)	SPAC24C9.12c
O13974	Putative ubiquitin thioesterase otu1, EC 3.4.19.12 (Meiotically up-regulated gene 141 protein) (OTU domain-containing protein 1)	otu1 mug141 SPAC24C9.14
O13979	Ubiquitin carboxyl-terminal hydrolase mug105, EC 3.4.19.12 (Lys-48-selective deubiquitinase mug105, DUB) (Meiotically up-regulated gene 105 protein)	mug105 SPAC25H1.04
O13985	Uncharacterized WD repeat-containing protein C26H5.03	SPAC26H5.03
O13990	Glucan 1,3-beta-glucosidase, EC 3.2.1.58 (Exo-1,3-beta-glucanase)	bgl2 SPAC26H5.08c
O13993	DNA-directed RNA polymerase, mitochondrial, EC 2.7.7.6	rpo41 SPAC26H5.12
O14001	Pyruvylated Gal-beta-1,3-epitope synthesis protein 2, PvGal synthesis protein 2 (Meiotically up-regulated gene 53 protein)	pvg2 mug53 SPAC27E2.07
O14002	Peroxide stress-activated histidine kinase mak2, EC 2.7.13.3 (His-Asp phosphorelay kinase phk1) (Mcs4-associated kinase 2)	mak2 phk1 SPAC27E2.09
O14007	H/ACA ribonucleoprotein complex subunit cbf5, EC 5.4.99.- (Centromere-binding factor 5 homolog)	cbf5 SPAC29A4.04c
O14027	Probable pyridoxal 5'-phosphate synthase subunit PDX1, PLP synthase subunit PDX1, EC 4.3.3.6	snz1 SPAC29B12.04
O14029	COPII coat assembly protein sec16 (Protein transport protein sec16)	sec16 SPAC29B12.07
O14044	Pre-rRNA-processing protein pno1 (Ribosomal RNA-processing protein 28)	rbp28 pno1 SPAC2C4.11c
O14047	Serine/threonine-protein kinase ppk11, EC 2.7.11.1	ppk11 SPAC2C4.14c
O14084	Inositol phosphoceramide mannosyltransferase 1, EC 2.4.-.- (IPC mannosyltransferase 1)	imt1 SPAC2F3.01 SPAC323.09
O14091	General alpha-glucoside permease	sut1 SPAC2F3.08
O14100	Protein zds1 (Meiotically up-regulated gene 88 protein)	zds1 mug88 SPAC31F12.01 SPAC637.14
O14107	Cell fusion protein dni1 (Delayed minus-nitrogen induction protein 1)	dni1 SPAC31G5.07
O14113	Telomere maintenance protein SDE2 (Silencing defective protein 2)	sde2 SPAC31G5.18c
O14115	Triacylglycerol lipase ptl2, EC 3.1.1.3	ptl2 SPAC1786.01c SPAC31G5.20c
O14134	mRNA export factor elf1	elf1 SPAC3C7.08c
O14140	26S proteasome complex subunit rpn15 (mRNA export factor dss1)	rpn15 dss1 sem1 SPAC3G6.02
O14141	dTTP/UTP pyrophosphatase, dTTPase/UTPase, EC 3.6.1.9 (Maf-like protein C3G6.03c) (Nucleoside triphosphate pyrophosphatase) (Nucleotide pyrophosphatase, Nucleotide PPase)	SPAC3G6.03c
O14145	Trehalose-phosphatase, EC 3.1.3.12 (Trehalose synthase complex catalytic subunit tps2) (Trehalose-6-phosphate phosphatase, TPP)	tps2 SPAC3G6.09c
O14146	Vacuolar protein sorting-associated protein 51 (GARP complex subunit vps51)	vps51 SPAC3G6.10c
O14147	ATP-dependent DNA helicase chl1, EC 3.6.4.12 (Chromosome loss protein 1)	chl1 SPAC3G6.11
O14154	Alpha-amylase mde5, EC 3.2.1.1 (1,4-alpha-D-glucan glucanohydrolase) (Mei4-dependent protein 5) (Meiotic expression up-regulated protein 30)	mde5 meu30 SPAC25H1.09 SPAC4A8.01
O14159	Sphingoid long chain base kinase 4, LCB kinase 4, EC 2.7.1.91 (Sphinganine kinase 4)	lcb4 SPAC4A8.07c
O14171	Dehydrodolichyl diphosphate synthase complex subunit SPAC4D7.04c, EC 2.5.1.87 (Ditrans,polycis-polyprenyl diphosphate synthase ((2E,6E)-farnesyl diphosphate specific))	SPAC4D7.04c
O14172	Siroheme biosynthesis protein met8 [Includes: Precorrin-2 dehydrogenase, EC 1.3.1.76; Sirohydrochlorin ferrochelatase, EC 4.99.1.4 ]	met8 SPAC4D7.06c
O14175	DSC E3 ubiquitin ligase complex subunit 4 (Defective for SREBP cleavage protein 4)	dsc4 SPAC4D7.11
O14177	ESCRT-III complex subunit did4 (Vacuolar protein-sorting-associated protein 2)	did4 vps2 SPAC4F8.01 SPAC644.03c
O14185	Transgelin (Calponin homolog 1)	stg1 SPAC4F8.10c
O14198	Mediator of RNA polymerase II transcription subunit 18 (Cell separation protein sep11) (Mediator complex subunit 18) (RNA polymerase II mediator complex protein pmc6)	med18 pmc6 sep11 SPAC5D6.05
O14201	Meiotically up-regulated gene 86 protein	mug86 SPAC5D6.09c
O14205	Vacuolar protein sorting-associated protein 74	vps74 SPAC5D6.13 SPAPJ735.02c
O14210	INO80 complex subunit 2	ies2 SPAC6B12.05c
O14217	Probable mitochondrial import receptor subunit tom70 (Translocase of outer membrane 40 kDa subunit)	tom70 SPAC6B12.12
O14228	Phosphoribosylformylglycinamidine synthase, FGAM synthase, FGAMS, EC 6.3.5.3 (Formylglycinamide ribonucleotide amidotransferase, FGAR amidotransferase, FGAR-AT) (Formylglycinamide ribotide amidotransferase)	ade3 min11 SPAC6F12.10c
O14229	Transcription factor tau subunit sfc1 (TFIIIC subunit sfc1) (Transcription factor C subunit 1)	sfc1 tfc1 SPAC6F12.11c
O14239	Polarized growth protein rax2 (Revert to axial protein 2)	rax2 SPAC6F6.06c
O14240	Chromatin modification-related protein eaf6	eaf6 SPAC6F6.09
O14241	Actin-related protein 2/3 complex subunit 2 (Arp2/3 complex 34 kDa subunit, p34-ARC)	arc2 arc34 SPAC6F6.10c
O14248	Tip elongation aberrant protein 3 (Cell polarity protein tea3)	tea3 SPAC6G10.02c
O14249	Probable cardiolipin-specific deacylase 1, mitochondrial, EC 3.5.1.-	SPAC6G10.03c
O14253	Nuclear cap-binding protein subunit 1 (80 kDa nuclear cap-binding protein, CBP80, NCBP 80 kDa subunit)	cbc1 SPAC6G10.07
O14255	Probable mannosyl-oligosaccharide glucosidase, EC 3.2.1.106 (Processing A-glucosidase I)	SPAC6G10.09
O14259	Ubp4-interactor sfp47	sfp47 SPAC7D4.02c
O14286	Iron-sulfur clusters transporter atm1, mitochondrial, EC 7.-.-.-	atm1 SPAC15A10.01 SPAC8C9.18
O14289	3-isopropylmalate dehydratase, EC 4.2.1.33 (Alpha-IPM isomerase, IPMI) (Isopropylmalate isomerase)	leu2 SPAC9E9.03
O14311	SAGA complex subunit spt3	spt3 SPCC61.02
O14318	CCAAT-binding factor complex subunit php4	php4 SPBC16E9.01c SPBP16F5.09c
O14321	Sterol 24-C-methyltransferase erg6, SCMT, SMT, EC 2.1.1.-, EC 2.1.1.41 (Delta(24)-sterol C-methyltransferase erg6) (Ergosterol biosynthesis protein 6)	erg6 SPBC16E9.05
O14328	Serine/threonine-protein kinase ksp1, EC 2.7.11.1 (Serine/threonine-protein kinase ppk20)	ksp1 ppk20 SPBC16E9.13
O14335	DNA-binding protein scr1	scr1 SPBC1D7.02c
O14340	Oxysterol-binding protein homolog C2F12.05c	SPBC2F12.05c
O14344	Inosine-5'-monophosphate dehydrogenase, IMP dehydrogenase, IMPD, IMPDH, EC 1.1.1.205	gua1 SPBC2F12.14c
O14345	Palmitoyltransferase pfa3, EC 2.3.1.225 (Protein fatty acyltransferase 3)	pfa3 SPBC2F12.15c
O14352	Probable U6 snRNA-associated Sm-like protein LSm4	lsm4 SPBC30D10.06
O14353	Biotin--protein ligase, EC 6.3.4.- (Biotin apo-protein ligase) [Includes: Biotin--[methylmalonyl-CoA-carboxytransferase] ligase, EC 6.3.4.9; Biotin--[propionyl-CoA-carboxylase [ATP-hydrolyzing]] ligase, EC 6.3.4.10 (Holocarboxylase synthetase, HCS); Biotin--[methylcrotonoyl-CoA-carboxylase] ligase, EC 6.3.4.11; Biotin--[acetyl-CoA-carboxylase] ligase, EC 6.3.4.15 ]	bpl1 SPBC30D10.07c
O14360	H/ACA ribonucleoprotein complex non-core subunit NAF1 (Nuclear assembly factor 1)	naf1 SPBC30D10.15
O14362	Cell wall biosynthesis/cell cycle regulator smi1	smi1 SPBC30D10.17c
O14368	Heat shock protein 16 (16 kDa heat shock protein)	hsp16 SPBC3E7.02c
O14459	DNA-directed RNA polymerase II subunit rpb7, RNA polymerase II subunit B7	rpb7 SPACUNK4.06c SPAPYUK71.02
O14460	Elongation factor 2, EF-2	eft201 eft2 eft2-1 SPAC513.01c SPAPYUK71.04c; eft202 SPCP31B10.07
O14466	Dolichol-phosphate mannosyltransferase, EC 2.4.1.83 (Dolichol-phosphate mannose synthase, DPM synthase) (Dolichyl-phosphate beta-D-mannosyltransferase) (Mannose-P-dolichol synthase, MPD synthase)	dpm1 SPAC31G5.16c
O36014	Aspartyl aminopeptidase 1, EC 3.4.11.21	aap1 SPAC4F10.02
O36015	Putative tRNA (cytidine(32)/guanosine(34)-2'-O)-methyltransferase, EC 2.1.1.205 (2'-O-ribose RNA methyltransferase TRM7 homolog)	SPAC4F10.03c
O36022	Mannan polymerase complex subunit mnn9	mnn9 SPAC4F10.10c
O36024	Inner kinetochore subunit fta1 (CENP-L homolog) (Constitutive centromere-associated network protein fta1) (Sim4 complex subunit fta1) (Sim4-mal2-associated protein 1)	fta1 sma1 SPAC4F10.12
O42643	Pre-mRNA-splicing factor ATP-dependent RNA helicase prp22, EC 3.6.4.13	prp22 SPAC10F6.02c
O42644	CTP synthase, EC 6.3.4.2 (CTP synthetase) (UTP--ammonia ligase)	ura7 SPAC10F6.03c
O42646	Ubiquitin-conjugating enzyme E2 6, EC 2.3.2.23 (E2 ubiquitin-conjugating enzyme 6) (Ubiquitin carrier protein 6) (Ubiquitin-protein ligase 6)	ubc6 SPAC10F6.05c
O42650	Serine/threonine-protein kinase rio1, EC 2.7.11.1, EC 3.6.3.-	rio1 SPAC10F6.10
O42651	Autophagy-related protein 17	atg17 SPAC10F6.11c
O42652	Aspartate aminotransferase, cytoplasmic, EC 2.6.1.1 (Transaminase A)	aat2 SPAC10F6.13c
O42658	Pterin-4-alpha-carbinolamine dehydratase, PHS, EC 4.2.1.96 (4-alpha-hydroxy-tetrahydropterin dehydratase) (Overlapping meiotic transcript 2) (Pterin carbinolamine dehydratase, PCD)	omt2 SPAC27D7.04
O42659	Anaphase-promoting complex subunit 14 (20S cyclosome/APC complex protein apc14) (Overlapping meiotic transcript protein 1)	apc14 omt1 SPAC27D7.05c
O42666	Uba3-binding protein but1 (Meiotically up-regulated gene 107 protein)	but1 mug107 SPAC27D7.12c
O42668	Tetratricopeptide repeat protein 1	tpr1 SPAC27D7.14c SPAC637.02c
O42839	Anaphase-promoting complex subunit 4 (20S cyclosome/APC complex protein apc4) (Cell untimely torn protein 20)	cut20 apc4 lid1 SPAC19G12.01c SPAPJ698.04c
O42842	Adenine phosphoribosyltransferase, APRT, EC 2.4.2.7	apt1 SPAC23A1.03
O42869	Uncharacterized protein C3G9.05	SPAC3G9.05
O42871	Chromatin modification-related protein png1 (ING1 homolog 1)	png1 SPAC3G9.08
O42890	Copper amine oxidase-like protein cao2, EC 1.4.3.21	cao2 spao2 SPBC1289.16c SPBC8E4.06
O42894	Exosome complex component rrp46 (Ribosomal RNA-processing protein 46)	rrp46 SPBC115.01c
O42904	Pre-mRNA-processing factor 31	prp31 SPBC119.13c
O42905	DNA repair and recombination protein rti1 (Rad twenty-two isogene 1) (Rad22 homolog)	rti1 SPBC119.14
O42913	Transcription factor nrm1 (Negative regulator of MBF targets 1)	nrm1 SPBC16A3.07c
O42918	Alpha-amylase 4, EC 3.2.1.1 (1,4-alpha-D-glucan glucanohydrolase) (Meiotic expression up-regulated protein 7)	meu7 aah4 SPBC16A3.13
O42931	26S proteasome regulatory subunit 7 homolog	rpt1 SPBC16C6.07c
O42936	Pre-rRNA-processing protein las1	las1 SPBC16C6.12c
O42939	Ubiquitin-activating enzyme E1-like (Pmt3-activating enzyme subunit 2)	uba2 SPBC16H5.03c
O42941	Peptidylprolyl isomerase cyp7, PPIase cyp7, EC 5.2.1.8 (Complexed with cdc5 protein 27) (Cyclophilin 7) (Rotamase cyp7)	cyp7 cwf27 SPBC16H5.05c
O42945	Probable pre-mRNA-splicing factor ATP-dependent RNA helicase prp43, EC 3.6.4.13	prp43 SPBC16H5.10c
O42954	MADS-box transcription factor 1	mbx1 SPBC19G7.06
O42955	Pentatricopeptide repeat-containing protein 3, mitochondrial (Mitochondrial group I intron splicing factor dmr1)	ppr3 dmr1 SPBC19G7.07c
O42956	Arrestin family protein 1	art1 SPBC19G7.08c
O42957	Ubiquitin-like-specific protease 1, EC 3.4.22.-	ulp1 SPBC19G7.09
O42963	Nucleoporin nup44 (Nuclear pore protein nup44)	nup44 SPBC19G7.15
O42971	Anaphase-promoting complex subunit 10 (20S cyclosome/APC complex protein apc10)	apc10 SPBC1A4.01 SPBC1E8.06
O42978	U6 snRNA-associated Sm-like protein LSm5	lsm5 SPBC20F10.09
O42980	NEDD8-specific protease 1, EC 3.4.22.-	nep1 SPBC17D11.01 SPBC20F10.11
O42993	Peptidyl-prolyl cis-trans isomerase, PPIase, EC 5.2.1.8 (FK506-binding protein, FKBP)	fkh1 SPBC24E9.17c SPBC839.17c
O43005	AP-2 complex subunit beta (Beta-2-adaptin) (Beta-adaptin) (Clathrin assembly protein complex 2 beta large chain) (Clathrin assembly protein large beta chain)	apl1 SPBC2G2.06c
O43010	Glycylpeptide N-tetradecanoyltransferase, EC 2.3.1.97 (Myristoyl-CoA:protein N-myristoyltransferase, NMT) (Peptide N-myristoyltransferase)	nmt1 SPBC2G2.11
O43011	Histidine--tRNA ligase, mitochondrial, EC 6.1.1.21 (Histidyl-tRNA synthetase, HisRS)	hts1 SPBC2G2.12
O43017	Set1 complex component swd3, Set1C component swd3 (COMPASS component swd3) (Complex proteins associated with set1 protein swd3)	swd3 SPBC354.03
O43019	Putative transcription factor sre2 (Sterol regulatory element-binding protein 2)	sre2 SPBC354.05c
O43027	Probable Rho-GTPase-activating protein 6	rga6 SPBC354.13
O43038	Vacuolar protein-sorting-associated protein 36	vps36 SPBC3B9.09
O43040	Cleavage and termination factor 1 (Transcription termination factor ctf1)	ctf1 SPBC3B9.11c
O43044	Nucleoporin nup120 (Nuclear pore protein nup120)	nup120 SPBC3B9.16c
O43050	Sterol-4-alpha-carboxylate 3-dehydrogenase erg26, decarboxylating, EC 1.1.1.170 (C-3 sterol dehydrogenase erg26) (C-4 decarboxylase erg26) (Ergosterol biosynthetic protein 26)	erg26 SPBC3F6.02c
O43053	Probable dolichyl pyrophosphate Man9GlcNAc2 alpha-1,3-glucosyltransferase, EC 2.4.1.267 (Asparagine-linked glycosylation protein 6) (Dol-P-Glc:Man(9)GlcNAc(2)-PP-Dol alpha-1,3-glucosyltransferase) (Dolichyl-P-Glc:Man9GlcNAc2-PP-dolichyl glucosyltransferase)	alg6 SPBC342.01c SPBC3F6.06c
O43059	Cytoskeletal protein syp1	syp1 SPBC4C3.06
O43063	Probable proteasome subunit beta type-1, EC 3.4.25.1	pre3 SPBC4C3.10c
O43065	Probable helicase mot1, EC 3.6.4.- (Modifier of transcription 1) (TBP-associated factor mot1)	mot1 SPBC1826.01c SPBC25B2.12.c SPBC6B1.01c
O43066	Serine/threonine-protein kinase ppk30, EC 2.7.11.1	ppk30 SPBC6B1.02
O43071	Pre-mRNA-processing factor 17	prp17 SPBC6B1.10
O43077	Sporulation protein kinase mde3, EC 2.7.11.1 (Mei4-dependent protein 3)	mde3 pi046 SPBC8D2.19
O43078	ATPase-like fidgetin (Protein sur2)	alf1 sur2 SPBC947.01
O43079	AP-1 complex subunit beta-1 (Beta(1)-adaptin, Beta-1-adaptin) (Clathrin assembly protein complex 1 beta-1 large chain) (Clathrin assembly protein large beta-1 chain)	apl2 SPBC947.02
O43087	Karyogamy meiotic segregation protein 2	kms2 SPBC947.12
O59666	Copper-transporting ATPase ccc2, EC 7.2.2.8 (Cu(2+)-ATPase)	ccc2 SPBC29A3.01
O59667	Histidine biosynthesis bifunctional protein his7 [Includes: Phosphoribosyl-AMP cyclohydrolase, EC 3.5.4.19; Phosphoribosyl-ATP pyrophosphatase, EC 3.6.1.31 ]	his7 SPBC29A3.02c
O59669	SWR1 complex subunit vps71	vps71 SPBC29A3.05
O59680	Cytochrome c1, heme protein, mitochondrial, EC 7.1.1.8 (Complex III subunit 4) (Complex III subunit IV) (Cytochrome b-c1 complex subunit 4) (Ubiquinol-cytochrome-c reductase complex cytochrome c1 subunit, Cytochrome c-1)	cyt1 SPBC29A3.18
O59697	Serine/threonine-protein kinase ppk25, EC 2.7.11.1	ppk25 SPBC32C12.03c
O59706	Pre-mRNA-splicing factor sap61 (Spliceosome-associated protein 61)	sap61 SPBC36.09
O59710	Probable NADPH:adrenodoxin oxidoreductase, mitochondrial, AR, Adrenodoxin reductase, EC 1.18.1.6 (Ferredoxin--NADP(+) reductase, Ferredoxin reductase)	arh1 SPBC3B8.01c
O59713	2-(3-amino-3-carboxypropyl)histidine synthase subunit 1, EC 2.5.1.108 (Diphthamide biosynthesis protein 1) (Diphtheria toxin resistance protein 1) (S-adenosyl-L-methionine:L-histidine 3-amino-3-carboxypropyltransferase 1)	dph1 SPBC3B8.05
O59715	Sphingolipid delta(4)-desaturase, EC 1.14.19.17 (Delta 4-(E)-sphingolipid desaturase) (Dihydroceramide desaturase)	dsd1 SPBC3B8.07c
O59721	tRNA pseudouridine synthase 4, EC 5.4.99.25 (tRNA pseudouridine(55) synthase, Psi55 synthase) (tRNA pseudouridylate synthase 4) (tRNA-uridine isomerase 4)	SPBC11C11.10 SPBC3B8.13c
O59722	1-phosphatidylinositol 3-phosphate 5-kinase fab1, Phosphatidylinositol 3-phosphate 5-kinase, EC 2.7.1.150 (Diphosphoinositide kinase) (Type III PIP kinase, PIPkin-III)	fab1 ste12 SPBC3E7.01 SPBC6B1.11c
O59730	Methionine aminopeptidase 1, MAP 1, MetAP 1, EC 3.4.11.18 (Peptidase M 1)	fma1 SPBC3E7.10
O59734	Small nuclear ribonucleoprotein F, snRNP-F (Sm protein F, Sm-F, SmF)	smf1 SPBC3E7.14 SPBC4F6.01
O59735	Sphingosine N-acyltransferase lac1, EC 2.3.1.24 (Meiotically up-regulated gene 83 protein)	lac1 mug83 SPBC3E7.15c SPBC4F6.02c
O59753	DNA repair protein rad14 (XP-A family homolog rhp14)	rhp14 rad14 SPBC649.03
O59770	Probable proteasome subunit alpha type-7	pre10 SPCC1795.04c
O59771	Uridylate kinase, UK, EC 2.7.4.14 (ATP:UMP phosphotransferase) (Deoxycytidylate kinase, CK, dCMP kinase) (Uridine monophosphate kinase, UMP kinase, UMPK)	SPCC1795.05c
O59773	Chromatin modification-related protein vid21 (Esa1-associated factor vid21) (Vacuolar import and degradation protein 21)	vid21 SPCC1795.08c
O59774	Aspartic proteinase yapsin-1, EC 3.4.23.-	yps1 SPCC1795.09
O59778	Biotin synthase, EC 2.8.1.6	bio2 SPCC1235.02 SPCC320.01c
O59786	Ferrochelatase, mitochondrial, EC 4.99.1.1 (Heme synthase) (Protoheme ferro-lyase)	hem15 SPCC320.09
O59793	Stress response protein bis1 (Splicing factor ESS-2 homolog)	bis1 SPCC364.02c
O59800	Pre-mRNA-splicing factor cwf5 (Complexed with cdc5 protein 5)	cwf5 ecm2 SPCC550.02c
O59810	Vigilin 1 (KH domain-containing protein vgl1)	vgl1 SPCC550.14
O59816	Dihydrolipoyllysine-residue acetyltransferase component of pyruvate dehydrogenase complex, mitochondrial, EC 2.3.1.12 (Dihydrolipoamide acetyltransferase component of pyruvate dehydrogenase complex) (Pyruvate dehydrogenase complex component E2, PDC-E2, PDCE2)	lat1 SPCC794.07
O59821	Exosome complex component csl4	csl4 SPCC1840.11 SPCC965.01
O59823	V-type proton ATPase subunit D, V-ATPase subunit D (Vacuolar proton pump subunit D)	vma8 SPCC965.03
O59824	ATP-dependent zinc metalloprotease YME1 homolog, EC 3.4.24.-	SPCC965.04c
O59825	G/U mismatch-specific uracil DNA glycosylase, EC 3.2.2.28 (Uracil mismatch repair protein)	thp1 SPCC965.05c
O59828	Alanine racemase, catabolic, EC 5.1.1.1	alr1 SPCC965.08c
O59834	Probable cytosine deaminase, EC 3.5.4.1 (Cytosine aminohydrolase)	SPCC965.14c
O59835	DNA polymerase delta subunit 4	cdm1 SPBC12D12.02c
O59838	Heat shock protein homolog pss1	pss1 ssp1 SPAC110.04c SPAP14E8.01c
O59852	Invertase, EC 3.2.1.26 (Beta-fructofuranosidase) (Saccharase)	inv1 SPCC191.11
O60060	Carbamoyl-phosphate synthase arginine-specific small chain, CPS-A, EC 6.3.5.5 (Arginine-specific carbamoyl-phosphate synthetase, glutamine chain)	arg5 cpa1 SPBC56F2.09c
O60062	Homoserine O-acetyltransferase, EC 2.3.1.31 (Homoserine O-trans-acetylase)	met6 SPBC56F2.11
O60072	RQC trigger complex helicase slh1 (Meiotically up-regulated gene 81 protein) (Putative helicase mug81, EC 3.6.4.13)	slh1 mug81 SPBC13G1.10c
O60079	Probable ubiquitin carboxyl-terminal hydrolase 12, EC 3.4.19.12 (Deubiquitinating enzyme 12) (Ubiquitin thioesterase 12) (Ubiquitin-specific-processing protease 12)	ubp12 SPCC1494.05c
O60087	Probable glucoamylase, EC 3.2.1.3 (1,4-alpha-D-glucan glucohydrolase) (Glucan 1,4-alpha-glucosidase) (Meiotic expression up-regulated protein 17)	meu17 SPBC14C8.05c
O60097	Transcription factor spt8	spt8 sep9 SPBC14C8.17c
O60102	Translation initiation factor rli1 (ATP-binding cassette sub-family E member rli1) (RNase L inhibitor)	rli1 SPBC14F5.06
O60103	ERAD-associated E3 ubiquitin-protein ligase doa10, EC 2.3.2.27 (RING-type E3 ubiquitin transferase doa10)	doa10 ssm4 SPBC14F5.07
O60105	Adenylosuccinate lyase, ASL, EC 4.3.2.2 (Adenylosuccinase, ASase)	ade8 SPBC14F5.09c
O60107	Sorting nexin-41 (Meiotically up-regulated gene 186 protein)	snx41 mug186 SPBC14F5.11c
O60124	Exosome complex component rrp42 (Ribosomal RNA-processing protein 42)	rrp42 SPBC16G5.10
O60135	Long-chain-fatty-acid--CoA ligase 1, EC 6.2.1.3 (Fatty acid activator 1) (Long-chain acyl-CoA synthetase 1)	lcf1 SPBC18H10.02
O60137	Set1 complex component swd2, Set1C component swd2 (COMPASS component swd2) (Complex proteins associated with set1 protein swd2)	swd2 swd2.1 SPBC18H10.06c
O60146	Uncharacterized transporter C18H10.16	SPBC18H10.16
